고유사번,평가자 고유사번,확인자 고유사번,평가관점,점수,평가의견,평균,평가등급
307080,4800000,2200101,변화관리/전략적마인드셋,4,목표설정이 우수하고 업무우선순위 파악이 빠름,4.25,B
307080,4800000,2200101,성과관리/조직장악력,4,조직 구성원의 장단점 파악 및 적재적소 인력운영하는 관리역량 보유,4.25,B
307080,4800000,2200101,경영자적 마인드,4,친화력있는 리더십으로 향후 성장이 기대됨,4.25,B
307080,4800000,2200101,커뮤니케이션/보고역량,5,경영진의 의도를 부서에 정확히 전달하는 능력 보유,4.25,B
9001101,4800000,2200101,변화관리/전략적마인드셋,3,업무의 우선순위 설정에 미흡한 부분이 있음,3.75,B
9001101,4800000,2200101,성과관리/조직장악력,5,경비절감 능력 우수,3.75,B
9001101,4800000,2200101,경영자적 마인드,4,각 부서 간 소통과 화합 능력 우수,3.75,B
9001101,4800000,2200101,커뮤니케이션/보고역량,3,커뮤니케이션 측면에서 본인의 생각을 잘 정리하여 전달하는 역량은 미흡,3.75,B
